{
  "schema_version": "1.0.0",
  "canon_status": "PROPOSED",
  "records": [
    {
      "id": "p2-deliverable-01",
      "path": "CONTINENT_MASTER_PLAN.md",
      "status": "DOCUMENTED_PROPOSED",
      "canon_status": "PROPOSED",
      "source_ids": [
        "P2-SRC-DIRECTIVE"
      ]
    },
    {
      "id": "p2-deliverable-02",
      "path": "CONTINENT_GEOGRAPHY.md",
      "status": "DOCUMENTED_PROPOSED",
      "canon_status": "PROPOSED",
      "source_ids": [
        "P2-SRC-DIRECTIVE"
      ]
    },
    {
      "id": "p2-deliverable-03",
      "path": "CONTINENT_MAP_SPECIFICATION.md",
      "status": "DOCUMENTED_PROPOSED",
      "canon_status": "PROPOSED",
      "source_ids": [
        "P2-SRC-DIRECTIVE"
      ]
    },
    {
      "id": "p2-deliverable-04",
      "path": "WORLD_REGION_GRAPH.json",
      "status": "DOCUMENTED_PROPOSED",
      "canon_status": "PROPOSED",
      "source_ids": [
        "P2-SRC-DIRECTIVE"
      ]
    },
    {
      "id": "p2-deliverable-05",
      "path": "FIFTEEN_REGION_BLUEPRINTS/",
      "status": "DOCUMENTED_PROPOSED",
      "canon_status": "PROPOSED",
      "source_ids": [
        "P2-SRC-DIRECTIVE"
      ]
    },
    {
      "id": "p2-deliverable-06",
      "path": "CAPITAL_CITY_BLUEPRINTS/",
      "status": "DOCUMENTED_PROPOSED",
      "canon_status": "PROPOSED",
      "source_ids": [
        "P2-SRC-DIRECTIVE"
      ]
    },
    {
      "id": "p2-deliverable-07",
      "path": "SETTLEMENT_REGISTRY.json",
      "status": "DOCUMENTED_PROPOSED",
      "canon_status": "PROPOSED",
      "source_ids": [
        "P2-SRC-DIRECTIVE"
      ]
    },
    {
      "id": "p2-deliverable-08",
      "path": "WORLD_POI_REGISTRY.json",
      "status": "DOCUMENTED_PROPOSED",
      "canon_status": "PROPOSED",
      "source_ids": [
        "P2-SRC-DIRECTIVE"
      ]
    },
    {
      "id": "p2-deliverable-09",
      "path": "TRANSPORTATION_NETWORK.md",
      "status": "DOCUMENTED_PROPOSED",
      "canon_status": "PROPOSED",
      "source_ids": [
        "P2-SRC-DIRECTIVE"
      ]
    },
    {
      "id": "p2-deliverable-10",
      "path": "REGIONAL_BIOME_SPECIFICATIONS.md",
      "status": "DOCUMENTED_PROPOSED",
      "canon_status": "PROPOSED",
      "source_ids": [
        "P2-SRC-DIRECTIVE"
      ]
    },
    {
      "id": "p2-deliverable-11",
      "path": "WORLD_ECOLOGY_SYSTEM.md",
      "status": "DOCUMENTED_PROPOSED",
      "canon_status": "PROPOSED",
      "source_ids": [
        "P2-SRC-DIRECTIVE"
      ]
    },
    {
      "id": "p2-deliverable-12",
      "path": "DYNAMIC_WEATHER_SYSTEM.md",
      "status": "DOCUMENTED_PROPOSED",
      "canon_status": "PROPOSED",
      "source_ids": [
        "P2-SRC-DIRECTIVE"
      ]
    },
    {
      "id": "p2-deliverable-13",
      "path": "NPC_CIVILIZATION_SYSTEM.md",
      "status": "DOCUMENTED_PROPOSED",
      "canon_status": "PROPOSED",
      "source_ids": [
        "P2-SRC-DIRECTIVE"
      ]
    },
    {
      "id": "p2-deliverable-14",
      "path": "WORLD_EVENT_REGISTRY.json",
      "status": "DOCUMENTED_PROPOSED",
      "canon_status": "PROPOSED",
      "source_ids": [
        "P2-SRC-DIRECTIVE"
      ]
    },
    {
      "id": "p2-deliverable-15",
      "path": "DUNGEON_AND_EXPLORATION_PLAN.md",
      "status": "DOCUMENTED_PROPOSED",
      "canon_status": "PROPOSED",
      "source_ids": [
        "P2-SRC-DIRECTIVE"
      ]
    },
    {
      "id": "p2-deliverable-16",
      "path": "ARCHITECTURAL_KIT_REGISTRY.json",
      "status": "DOCUMENTED_PROPOSED",
      "canon_status": "PROPOSED",
      "source_ids": [
        "P2-SRC-DIRECTIVE"
      ]
    },
    {
      "id": "p2-deliverable-17",
      "path": "ENVIRONMENT_ASSET_REGISTRY.json",
      "status": "DOCUMENTED_PROPOSED",
      "canon_status": "PROPOSED",
      "source_ids": [
        "P2-SRC-DIRECTIVE"
      ]
    },
    {
      "id": "p2-deliverable-18",
      "path": "WORLD_STREAMING_ARCHITECTURE.md",
      "status": "DOCUMENTED_PROPOSED",
      "canon_status": "PROPOSED",
      "source_ids": [
        "P2-SRC-DIRECTIVE"
      ]
    },
    {
      "id": "p2-deliverable-19",
      "path": "WORLD_CONSTRUCTION_ROADMAP.md",
      "status": "DOCUMENTED_PROPOSED",
      "canon_status": "PROPOSED",
      "source_ids": [
        "P2-SRC-DIRECTIVE"
      ]
    },
    {
      "id": "p2-deliverable-20",
      "path": "CANON_ALIGNMENT_AND_GAP_REPORT.md",
      "status": "DOCUMENTED_PROPOSED",
      "canon_status": "PROPOSED",
      "source_ids": [
        "P2-SRC-DIRECTIVE"
      ]
    }
  ],
  "registry_kind": "administrative_coverage",
  "source_ids": [
    "P2-SRC-DIRECTIVE"
  ]
}
